{
  "assurance_state": "source_corresponding",
  "checks": [
    {
      "actual": "commcanary.trace.v1",
      "expected": "commcanary.trace.v1",
      "name": "source_format",
      "status": "pass"
    }
  ],
  "format": "commcanary.fidelity_verification.v1",
  "source_events": 0,
  "status": "source_verified",
  "timing_sample_limit": 128
}
